{
  "provider": "MOCK_POS_VENDOR",
  "batchNo": "POSB20260907001",
  "businessDate": "2026-09-07",
  "schemaVersion": "1.0",
  "fileName": "POS_20260907_POSB20260907001.csv",
  "rowCount": 0,
  "checksumAlgorithm": "SHA-256",
  "checksum": "b6e5da80ae7c619c9f75a6f9098f0be1dbde4fee225f560eb69972864685ef70",
  "generatedAt": "2026-09-08T02:00:02+08:00",
  "correctionOfBatchNo": null
}
